{
  "$schema": "https://json-schema.org/draft/2020-12/schema",
  "$id": "https://petauron.com/contracts/catalog/v4/catalog-envelope.schema.json",
  "title": "Petauron schema 4 signed catalog envelope",
  "type": "object",
  "additionalProperties": false,
  "required": ["schemaVersion", "keyId", "payload", "signature"],
  "properties": {
    "schemaVersion": { "const": 4 },
    "keyId": { "type": "string", "pattern": "^[a-z0-9][a-z0-9._-]{0,63}$" },
    "payload": { "type": "string", "pattern": "^[A-Za-z0-9_-]+$" },
    "signature": { "type": "string", "pattern": "^[A-Za-z0-9_-]{86}$" }
  }
}
