{
  "schemaVersion": 4,
  "keyId": "fixture-key-2026",
  "payload": "ewogICJzY2hlbWFWZXJzaW9uIjogNCwKICAiZ2VuZXJhdGVkQXQiOiAiMjAyNi0wOC0xNVQwMDowMDowMFoiLAogICJhcHBzIjogWwogICAgewogICAgICAiaWQiOiAiZml4dHVyZS1hcHAiLAogICAgICAidmVyc2lvbiI6ICIxLjIuMyIsCiAgICAgICJuYW1lIjogewogICAgICAgICJlbiI6ICJGaXh0dXJlIGFwcCIsCiAgICAgICAgInpoLUNOIjogIuWkueWFt-W6lOeUqCIKICAgICAgfSwKICAgICAgImRlc2NyaXB0aW9uIjogewogICAgICAgICJlbiI6ICJQb3J0YWJsZSBzeW50aGV0aWMgZml4dHVyZSIsCiAgICAgICAgInpoLUNOIjogIuWPr-enu-akjeeahOWQiOaIkOWkueWFtyIKICAgICAgfSwKICAgICAgImxpY2Vuc2UiOiAiQXBhY2hlLTIuMCIsCiAgICAgICJpbWFnZXMiOiBbCiAgICAgICAgewogICAgICAgICAgIm5hbWUiOiAicnVudGltZSIsCiAgICAgICAgICAicmVmZXJlbmNlIjogInJlZ2lzdHJ5LmV4YW1wbGUuaW52YWxpZC9maXh0dXJlQHNoYTI1NjphYWFhYWFhYWFhYWFhYWFhYWFhYWFhYWFhYWFhYWFhYWFhYWFhYWFhYWFhYWFhYWFhYWFhYWFhYWFhYWFhYWFhIgogICAgICAgIH0KICAgICAgXSwKICAgICAgInNlcnZpY2VzIjogWwogICAgICAgIHsKICAgICAgICAgICJuYW1lIjogIm1hbmFnZXIiLAogICAgICAgICAgInByb3RvY29sIjogImh0dHAiLAogICAgICAgICAgImNvbnRhaW5lclBvcnQiOiA4MDgwLAogICAgICAgICAgImRlZmF1bHRIb3N0UG9ydCI6IDE4MDgwLAogICAgICAgICAgImhlYWx0aFBhdGgiOiAiL2hlYWx0aHoiLAogICAgICAgICAgIm1hbmFnZW1lbnQiOiB0cnVlCiAgICAgICAgfQogICAgICBdLAogICAgICAiaG9tZXBhZ2UiOiB7CiAgICAgICAgInNlcnZpY2UiOiAibWFuYWdlciIsCiAgICAgICAgInBhdGgiOiAiLyIKICAgICAgfSwKICAgICAgImhvc3RBY2Nlc3MiOiBmYWxzZSwKICAgICAgImNvbmZpZyI6IFsKICAgICAgICB7CiAgICAgICAgICAia2V5IjogImFkbWluX3NlY3JldCIsCiAgICAgICAgICAidHlwZSI6ICJzdHJpbmciLAogICAgICAgICAgImxhYmVsIjogewogICAgICAgICAgICAiZW4iOiAiQWRtaW5pc3RyYXRvciBzZWNyZXQiLAogICAgICAgICAgICAiemgtQ04iOiAi566h55CG5ZGY5a-G6ZKlIgogICAgICAgICAgfSwKICAgICAgICAgICJkZXNjcmlwdGlvbiI6IHsKICAgICAgICAgICAgImVuIjogIlN5bnRoZXRpYyB3cml0ZS1vbmx5IHZhbHVlIiwKICAgICAgICAgICAgInpoLUNOIjogIuWQiOaIkOeahOWPquWGmeWAvCIKICAgICAgICAgIH0sCiAgICAgICAgICAicmVxdWlyZWQiOiB0cnVlLAogICAgICAgICAgInNlY3JldCI6IHRydWUKICAgICAgICB9LAogICAgICAgIHsKICAgICAgICAgICJrZXkiOiAibGlzdGVuX3BvcnQiLAogICAgICAgICAgInR5cGUiOiAiaW50ZWdlciIsCiAgICAgICAgICAibGFiZWwiOiB7CiAgICAgICAgICAgICJlbiI6ICJMaXN0ZW4gcG9ydCIsCiAgICAgICAgICAgICJ6aC1DTiI6ICLnm5HlkKznq6_lj6MiCiAgICAgICAgICB9LAogICAgICAgICAgImRlc2NyaXB0aW9uIjogewogICAgICAgICAgICAiZW4iOiAiU3ludGhldGljIHBvcnQiLAogICAgICAgICAgICAiemgtQ04iOiAi5ZCI5oiQ56uv5Y-jIgogICAgICAgICAgfSwKICAgICAgICAgICJyZXF1aXJlZCI6IGZhbHNlLAogICAgICAgICAgInNlY3JldCI6IGZhbHNlLAogICAgICAgICAgImRlZmF1bHQiOiAxODA4MAogICAgICAgIH0sCiAgICAgICAgewogICAgICAgICAgImtleSI6ICJlbmFibGVkIiwKICAgICAgICAgICJ0eXBlIjogImJvb2xlYW4iLAogICAgICAgICAgImxhYmVsIjogewogICAgICAgICAgICAiZW4iOiAiRW5hYmxlZCIsCiAgICAgICAgICAgICJ6aC1DTiI6ICLlkK_nlKgiCiAgICAgICAgICB9LAogICAgICAgICAgImRlc2NyaXB0aW9uIjogewogICAgICAgICAgICAiZW4iOiAiU3ludGhldGljIHN3aXRjaCIsCiAgICAgICAgICAgICJ6aC1DTiI6ICLlkIjmiJDlvIDlhbMiCiAgICAgICAgICB9LAogICAgICAgICAgInJlcXVpcmVkIjogZmFsc2UsCiAgICAgICAgICAic2VjcmV0IjogZmFsc2UsCiAgICAgICAgICAiZGVmYXVsdCI6IHRydWUKICAgICAgICB9LAogICAgICAgIHsKICAgICAgICAgICJrZXkiOiAiZGlzcGxheV9uYW1lIiwKICAgICAgICAgICJ0eXBlIjogInN0cmluZyIsCiAgICAgICAgICAibGFiZWwiOiB7CiAgICAgICAgICAgICJlbiI6ICJEaXNwbGF5IG5hbWUiLAogICAgICAgICAgICAiemgtQ04iOiAi5pi-56S65ZCN56ewIgogICAgICAgICAgfSwKICAgICAgICAgICJkZXNjcmlwdGlvbiI6IHsKICAgICAgICAgICAgImVuIjogIlN5bnRoZXRpYyBsYWJlbCIsCiAgICAgICAgICAgICJ6aC1DTiI6ICLlkIjmiJDmoIfnrb4iCiAgICAgICAgICB9LAogICAgICAgICAgInJlcXVpcmVkIjogZmFsc2UsCiAgICAgICAgICAic2VjcmV0IjogZmFsc2UsCiAgICAgICAgICAiZGVmYXVsdCI6ICJGaXh0dXJlIgogICAgICAgIH0KICAgICAgXSwKICAgICAgInBhY2thZ2VSZXZpc2lvbiI6IDEsCiAgICAgICJydW50aW1lIjogewogICAgICAgICJraW5kIjogImRvY2tlciIsCiAgICAgICAgInZlcnNpb24iOiAxLAogICAgICAgICJkb2NrZXIiOiB7CiAgICAgICAgICAiY29udGFpbmVycyI6IFsKICAgICAgICAgICAgewogICAgICAgICAgICAgICJuYW1lIjogIm1haW4iLAogICAgICAgICAgICAgICJpbWFnZSI6ICJydW50aW1lIgogICAgICAgICAgICB9CiAgICAgICAgICBdCiAgICAgICAgfQogICAgICB9CiAgICB9CiAgXQp9Cg",
  "signature": "SeBQGNgJMc4osD-e1GcJ-eSOreHlifrF-QfzByeDgAJp8ZyOr2XuAtfUaIouX9R9xp_OudfPKG2h0ivP1rGPAg"
}
